<?xml version="1.0" encoding="UTF-8"?>
<!DOCTYPE component SYSTEM "../misc/component.dtd" [
<!ENTITY standard_uicomponent_attributes		SYSTEM "../entities/standard_uicomponent_attributes.xml">
<!ENTITY data_component_attributes				SYSTEM "../entities/data_component_attributes.xml">
<!ENTITY widget_var_attribute					SYSTEM "../entities/widget_var_attribute.xml">
]>
<component>
	<tag>ring</tag>
	<tagClass>org.primefaces.component.ring.RingTag</tagClass>
	<componentClass>org.primefaces.component.ring.Ring</componentClass>
	<componentType>org.primefaces.component.Ring</componentType>
	<componentFamily>org.primefaces.component</componentFamily>
	<rendererType>org.primefaces.component.RingRenderer</rendererType>
	<rendererClass>org.primefaces.component.ring.RingRenderer</rendererClass>
	<parent>org.primefaces.component.api.UIData</parent>
    <interfaces>
		<interface>
			<name>org.primefaces.component.api.Widget</name>
		</interface>
	</interfaces>
	<attributes>
		&data_component_attributes;
		&widget_var_attribute;
		<attribute>
			<name>style</name>
			<required>false</required>
			<type>java.lang.String</type>
		</attribute>
		<attribute>
			<name>styleClass</name>
			<required>false</required>
			<type>java.lang.String</type>
		</attribute>
        <attribute>
			<name>easing</name>
			<required>false</required>
			<type>java.lang.String</type>
		</attribute>
	</attributes>
	<resources>
		<resource>
			<name>ring/ring.css</name>
		</resource>
		<resource>
			<name>jquery/jquery.js</name>
		</resource>
		<resource>
			<name>primefaces.js</name>
		</resource>
		<resource>
			<name>ring/ring.js</name>
		</resource>
	</resources>
</component>