<?xml version="1.0" encoding="UTF-8"?>
<!DOCTYPE component SYSTEM "../misc/component.dtd" [
<!ENTITY standard_uicomponent_attributes		SYSTEM "../entities/standard_uicomponent_attributes.xml">
<!ENTITY output_component_attributes			SYSTEM "../entities/output_component_attributes.xml">
<!ENTITY input_component_attributes				SYSTEM "../entities/input_component_attributes.xml">
<!ENTITY widget_var_attribute					SYSTEM "../entities/widget_var_attribute.xml">
]>
<component>
	<tag>selectBooleanButton</tag>
	<tagClass>org.primefaces.component.selectbooleanbutton.SelectBooleanButtonTag</tagClass>
	<componentClass>org.primefaces.component.selectbooleanbutton.SelectBooleanButton</componentClass>
	<componentType>org.primefaces.component.SelectBooleanButton</componentType>
	<componentFamily>org.primefaces.component</componentFamily>
	<rendererType>org.primefaces.component.SelectBooleanButtonRenderer</rendererType>
	<rendererClass>org.primefaces.component.selectbooleanbutton.SelectBooleanButtonRenderer</rendererClass>
	<parent>javax.faces.component.html.HtmlSelectBooleanCheckbox</parent>
    <interfaces>
		<interface>
			<name>org.primefaces.component.api.Widget</name>
		</interface>
	</interfaces>
	<attributes>
		&input_component_attributes;
        &widget_var_attribute;
        <attribute>
            <name>disabled</name>
            <required>false</required>
            <type>boolean</type>
            <ignoreInComponent>true</ignoreInComponent>
        </attribute>
        <attribute>
            <name>label</name>
            <required>false</required>
            <type>java.lang.String</type>
            <ignoreInComponent>true</ignoreInComponent>
        </attribute>
        <attribute>
            <name>onchange</name>
            <required>false</required>
            <type>java.lang.String</type>
            <ignoreInComponent>true</ignoreInComponent>
        </attribute>
        <attribute>
            <name>style</name>
            <required>false</required>
            <type>java.lang.String</type>
            <ignoreInComponent>true</ignoreInComponent>
        </attribute>
        <attribute>
            <name>styleClass</name>
            <required>false</required>
            <type>java.lang.String</type>
            <ignoreInComponent>true</ignoreInComponent>
        </attribute>
        <attribute>
            <name>onLabel</name>
            <required>true</required>
            <type>java.lang.String</type>
        </attribute>
        <attribute>
            <name>offLabel</name>
            <required>true</required>
            <type>java.lang.String</type>
        </attribute>
        <attribute>
            <name>onIcon</name>
            <required>false</required>
            <type>java.lang.String</type>
        </attribute>
        <attribute>
            <name>offIcon</name>
            <required>false</required>
            <type>java.lang.String</type>
        </attribute>
	</attributes>
    <resources>
        <resource>
			<name>primefaces.css</name>
		</resource>
		<resource>
			<name>jquery/jquery.js</name>
		</resource>
        <resource>
			<name>primefaces.js</name>
		</resource>
	</resources>
</component>