<?xml version="1.0" encoding="UTF-8"?>
<!DOCTYPE component SYSTEM "../misc/component.dtd" [
<!ENTITY standard_uicomponent_attributes		SYSTEM "../entities/standard_uicomponent_attributes.xml">
<!ENTITY widget_var_attribute					SYSTEM "../entities/widget_var_attribute.xml">
]>
<component>
	<tag>spotlight</tag>
	<tagClass>org.primefaces.component.spotlight.SpotlightTag</tagClass>
	<componentClass>org.primefaces.component.spotlight.Spotlight</componentClass>
	<componentType>org.primefaces.component.Spotlight</componentType>
	<componentFamily>org.primefaces.component</componentFamily>
	<rendererType>org.primefaces.component.SpotlightRenderer</rendererType>
	<rendererClass>org.primefaces.component.spotlight.SpotlightRenderer</rendererClass>
	<parent>javax.faces.component.UIComponentBase</parent>
    <description>Spotlight highlights a certain component on page.</description>
    <interfaces>
		<interface>
			<name>org.primefaces.component.api.Widget</name>
		</interface>
	</interfaces>
	<attributes>
		&standard_uicomponent_attributes;
		&widget_var_attribute;
		<attribute>
			<name>target</name>
			<required>false</required>
			<type>java.lang.String</type>
            <description>Component to highlight.</description>
		</attribute>
        <attribute>
			<name>animate</name>
			<required>false</required>
			<type>java.lang.Boolean</type>
            <defaultValue>true</defaultValue>
            <description>When disabled, Displays block without animation effect</description>
		</attribute>
	</attributes>
	<resources>
        <resource>
			<name>primefaces.css</name>
		</resource>
		<resource>
			<name>jquery/jquery.js</name>
		</resource>
        <resource>
			<name>jquery/jquery-plugins.js</name>
		</resource>
		<resource>
			<name>primefaces.js</name>
		</resource>
	</resources>
</component>