<?xml version="1.0" encoding="UTF-8"?>
<!DOCTYPE component SYSTEM "../misc/component.dtd" [
<!ENTITY standard_uicomponent_attributes		SYSTEM "../entities/standard_uicomponent_attributes.xml">
<!ENTITY widget_var_attribute					SYSTEM "../entities/widget_var_attribute.xml">
]>
<component>
	<tag>barChart</tag>
	<tagClass>org.primefaces.component.chart.bar.BarChartTag</tagClass>
	<componentClass>org.primefaces.component.chart.bar.BarChart</componentClass>
	<componentType>org.primefaces.component.chart.BarChart</componentType>
	<componentFamily>org.primefaces.component</componentFamily>
	<rendererType>org.primefaces.component.chart.BarChartRenderer</rendererType>
	<rendererClass>org.primefaces.component.chart.bar.BarChartRenderer</rendererClass>
	<parent>org.primefaces.component.chart.CartesianChart</parent>
    <interfaces>
		<interface>
			<name>org.primefaces.component.api.Widget</name>
		</interface>
	</interfaces>
	<attributes>
		&standard_uicomponent_attributes;
		&widget_var_attribute;
		<attribute>
			<name>value</name>
			<required>false</required>
			<type>org.primefaces.model.chart.CartesianChartModel</type>
			<ignoreInComponent>true</ignoreInComponent>
		</attribute>
        <attribute>
			<name>style</name>
			<required>false</required>
			<type>java.lang.String</type>
			<ignoreInComponent>true</ignoreInComponent>
		</attribute>
		<attribute>
			<name>styleClass</name>
			<required>false</required>
			<type>java.lang.String</type>
			<ignoreInComponent>true</ignoreInComponent>
		</attribute>
        <attribute>
			<name>title</name>
			<required>false</required>
			<type>java.lang.String</type>
            <ignoreInComponent>true</ignoreInComponent>
		</attribute>
        <attribute>
			<name>legendPosition</name>
			<required>false</required>
			<type>java.lang.String</type>
            <ignoreInComponent>true</ignoreInComponent>
		</attribute>
        <attribute>
			<name>barPadding</name>
			<required>false</required>
			<type>java.lang.Integer</type>
            <defaultValue>8</defaultValue>
		</attribute>
        <attribute>
			<name>barMargin</name>
			<required>false</required>
			<type>java.lang.Integer</type>
            <defaultValue>10</defaultValue>
		</attribute>
        <attribute>
			<name>orientation</name>
			<required>false</required>
			<type>java.lang.String</type>
            <defaultValue>vertical</defaultValue>
		</attribute>
        <attribute>
			<name>stacked</name>
			<required>false</required>
			<type>java.lang.Boolean</type>
            <defaultValue>false</defaultValue>
		</attribute>
        <attribute>
			<name>min</name>
			<required>false</required>
			<type>java.lang.Double</type>
			<defaultValue>java.lang.Double.MIN_VALUE</defaultValue>
		</attribute>
		<attribute>
			<name>max</name>
			<required>false</required>
			<type>java.lang.Double</type>
			<defaultValue>java.lang.Double.MAX_VALUE</defaultValue>
		</attribute>
        <attribute>
			<name>breakOnNull</name>
			<required>false</required>
			<type>java.lang.Boolean</type>
			<defaultValue>false</defaultValue>
		</attribute>
        <attribute>
			<name>seriesColors</name>
			<required>false</required>
			<type>java.lang.String</type>
            <ignoreInComponent>true</ignoreInComponent>
		</attribute>
        <attribute>
			<name>shadow</name>
			<required>false</required>
			<type>java.lang.Boolean</type>
            <ignoreInComponent>true</ignoreInComponent>
		</attribute>
        <attribute>
			<name>xaxisLabel</name>
			<required>false</required>
			<type>java.lang.String</type>
        <ignoreInComponent>true</ignoreInComponent>
		</attribute>
        <attribute>
			<name>yaxisLabel</name>
			<required>false</required>
			<type>java.lang.String</type>
        <ignoreInComponent>true</ignoreInComponent>
		</attribute>
        <attribute>
			<name>xaxisAngle</name>
			<required>false</required>
			<type>java.lang.Integer</type>
        <ignoreInComponent>true</ignoreInComponent>
		</attribute>
        <attribute>
			<name>yaxisAngle</name>
			<required>false</required>
			<type>java.lang.Integer</type>
            <ignoreInComponent>true</ignoreInComponent>
		</attribute>
        <attribute>
			<name>legendCols</name>
			<required>false</required>
			<type>java.lang.Integer</type>
            <description>Defines visible column count of chart legend.</description>
            <ignoreInComponent>true</ignoreInComponent>
		</attribute>
        <attribute>
			<name>legendRows</name>
			<required>false</required>
			<type>java.lang.Integer</type>
            <description>Defines visible row count of chart legend.</description>
            <ignoreInComponent>true</ignoreInComponent>
		</attribute>
        <attribute>
			<name>zoom</name>
			<required>false</required>
			<type>java.lang.Boolean</type>
            <defaultValue>false</defaultValue>
            <description>Enables plot zooming.</description>
		</attribute>
        <attribute>
			<name>extender</name>
			<required>false</required>
			<type>java.lang.String</type>
            <description>Javascript function to extend the chart with low level jqplot options.</description>
            <ignoreInComponent>true</ignoreInComponent>
		</attribute>
        <attribute>
			<name>animate</name>
			<required>false</required>
			<type>java.lang.Boolean</type>
            <defaultValue>false</defaultValue>
            <description>Enables animation on plot, default is false.</description>
		</attribute>
        <attribute>
			<name>showDatatip</name>
			<required>false</required>
			<type>java.lang.Boolean</type>
            <defaultValue>true</defaultValue>
            <description>Defines visibility of datatip, default is true.</description>
		</attribute>
        <attribute>
			<name>datatipFormat</name>
			<required>false</required>
			<type>java.lang.String</type>
            <description>Template string for datatips.</description>
		</attribute>
	</attributes>
	<resources>
        <resource>
			<name>charts/charts.css</name>
		</resource>
		<resource>
			<name>jquery/jquery.js</name>
		</resource>
		<resource>
			<name>primefaces.js</name>
		</resource>
		<resource>
			<name>charts/charts.js</name>
		</resource>
	</resources>
</component>