<?xml version="1.0" encoding="UTF-8"?>
<!DOCTYPE component SYSTEM "../misc/component.dtd" [
<!ENTITY standard_uicomponent_attributes		SYSTEM "../entities/standard_uicomponent_attributes.xml">
]>
<component>
	<tag>outputPanel</tag>
	<tagClass>org.primefaces.component.outputpanel.OutputPanelTag</tagClass>
	<componentClass>org.primefaces.component.outputpanel.OutputPanel</componentClass>
	<componentType>org.primefaces.component.OutputPanel</componentType>
	<componentFamily>org.primefaces.component</componentFamily>
	<rendererType>org.primefaces.component.OutputPanelRenderer</rendererType>
	<rendererClass>org.primefaces.component.outputpanel.OutputPanelRenderer</rendererClass>
	<parent>javax.faces.component.UIPanel</parent>
    <description>OutputPanel is used to group content on a page.</description>
    <interfaces>
        <interface>
			<name>org.primefaces.component.api.Widget</name>
		</interface>
		<interface>
			<name>org.primefaces.component.api.AutoUpdatable</name>
		</interface>
	</interfaces>
    <attributes>
		&standard_uicomponent_attributes;
		<attribute>
			<name>style</name>
			<required>false</required>
			<type>java.lang.String</type>
            <description>Style of the html container element.</description>
		</attribute>
		<attribute>
			<name>styleClass</name>
			<required>false</required>
			<type>java.lang.String</type>
            <description>StyleClass of the html container element.</description>
		</attribute>
        <attribute>
			<name>autoUpdate</name>
			<required>false</required>
			<type>java.lang.Boolean</type>
            <defaultValue>false</defaultValue>
            <description>Updates outputPanel after each ajax request implicity.</description>
		</attribute>
        <attribute>
			<name>deferred</name>
			<required>false</required>
			<type>java.lang.Boolean</type>
            <defaultValue>false</defaultValue>
            <description>Deferred mode loads the contents after page load to speed up page load.</description>
		</attribute>
        <attribute>
			<name>deferredMode</name>
			<required>false</required>
			<type>java.lang.String</type>
            <defaultValue>load</defaultValue>
            <description>Defines deferred loading mode, valid values are "load" (after page load) and "visible" (once the panel is visible on scroll). Default value is "load".</description>
		</attribute>
        <attribute>
            <name>global</name>
            <required>false</required>
            <type>java.lang.Boolean</type>
            <defaultValue>false</defaultValue>
            <description>Global ajax requests are listened by ajaxStatus component, setting global to false will not trigger ajaxStatus on deferred loading. Default is false.</description>
        </attribute>
        <attribute>
            <name>layout</name>
            <required>false</required>
            <type>java.lang.String</type>
            <defaultValue>block</defaultValue>
            <description>Shortcut for the css display property, valid values are block (default) and inline.</description>
        </attribute>
	</attributes>
    <resources>
		<resource>
			<name>primefaces.css</name>
		</resource>
		<resource>
			<name>jquery/jquery.js</name>
		</resource>
		<resource>
			<name>primefaces.js</name>
		</resource>
	</resources>
</component>