<?xml version="1.0" encoding="UTF-8"?>
<!DOCTYPE component SYSTEM "../misc/component.dtd" [
<!ENTITY standard_uicomponent_attributes		SYSTEM "../entities/standard_uicomponent_attributes.xml">
<!ENTITY widget_var_attribute					SYSTEM "../entities/widget_var_attribute.xml">
]>
<component>
	<tag>page</tag>
    <tagClass>org.primefaces.mobile.component.page.PageTag</tagClass>
	<componentClass>org.primefaces.mobile.component.page.Page</componentClass>
	<componentType>org.primefaces.mobile.Page</componentType>
	<componentFamily>org.primefaces.mobile.component</componentFamily>
	<rendererType>org.primefaces.mobile.component.PageRenderer</rendererType>
	<rendererClass>org.primefaces.mobile.component.page.PageRenderer</rendererClass>
	<parent>javax.faces.component.UIPanel</parent>
	<attributes>
		&standard_uicomponent_attributes;
        <attribute>
            <name>title</name>
            <required>false</required>
            <type>java.lang.String</type>
            <description>Title of the view.</description>
        </attribute>
        <attribute>
            <name>theme</name>
            <required>false</required>
            <type>java.lang.String</type>
            <description>Theme of the view.</description>
        </attribute>
        <attribute>
            <name>style</name>
            <required>false</required>
            <type>java.lang.String</type>
            <description>Inline style of the component.</description>
        </attribute>
        <attribute>
            <name>styleClass</name>
            <required>false</required>
            <type>java.lang.String</type>
            <description>Style class of the component.</description>
        </attribute>
        <attribute>
            <name>lazy</name>
            <required>false</required>
            <type>java.lang.Boolean</type>
            <defaultValue>false</defaultValue>
            <description>Lazy loading views are not rendered on initial page load to improve performance and instead lazily loaded on demand when there are first navigated to.</description>
        </attribute>
	</attributes>
</component>