<?xml version="1.0" encoding="UTF-8"?>
<!DOCTYPE component SYSTEM "../misc/component.dtd" [
<!ENTITY standard_uicomponent_attributes		SYSTEM "../entities/standard_uicomponent_attributes.xml">
<!ENTITY widget_var_attribute					SYSTEM "../entities/widget_var_attribute.xml">
]>
<component>
	<tag>content</tag>
    <tagClass>org.primefaces.mobile.component.content.ContentTag</tagClass>
	<componentClass>org.primefaces.mobile.component.content.Content</componentClass>
	<componentType>org.primefaces.mobile.Content</componentType>
	<componentFamily>org.primefaces.mobile.component</componentFamily>
	<rendererType>org.primefaces.mobile.component.ContentRenderer</rendererType>
	<rendererClass>org.primefaces.mobile.component.content.ContentRenderer</rendererClass>
	<parent>javax.faces.component.UIPanel</parent>
	<attributes>
		&standard_uicomponent_attributes;
        <attribute>
            <name>style</name>
            <required>false</required>
            <type>java.lang.String</type>
            <description>Inline style of the component.</description>
        </attribute>
        <attribute>
            <name>styleClass</name>
            <required>false</required>
            <type>java.lang.String</type>
            <description>Style class of the component.</description>
        </attribute>
	</attributes>
</component>